,Website,Areas of Specialization,Bio
William Nganje,https://www.ndsu.edu/agecon/faculty/william_nganje/#c622350,"Risk management; financial analysis; economics of obesity, food safety and food terrorism; experimental economics; and consumer choice theory",NA
David Bullock,https://www.ndsu.edu/agecon/faculty/bullock/#c622728,"futures and options markets, over-the-counter derivatives, trading, risk management, agrifinance, Monte Carlo simulation, and Big Data","Dr. David W. Bullock is a Research Associate Professor affiliated with the Center for Trading and Risk at NDSU.  His research interests include futures and options markets, over-the-counter derivatives, trading, risk management, agrifinance, Monte Carlo simulation, and Big Data applications in agriculture.  His academic research in option portfolio theory has been published in both the Journal of Economics and Business and the International Review of Economics and Finance.  Additionally, he was the primary contributor behind the AgriBank Insights publication series which won a National AgriMarketing Association (NAMA) award for the best company publication in 2016. Before coming to NDSU in January 2018, Dr. Bullock held numerous positions for over 25 years in the government and private sectors including the Senior Economist at AgriBank FCB – the regional Farm Credit System funding bank for the Upper Midwest region, Director of Research and Senior Foods Economist at Fortune 500 commodity risk management firm INTL FCStone Inc., the Senior Dairy Analyst at Informa Economics, a Risk Management Specialist with the Minnesota Department of Agriculture, and the Senior Economist at the Minneapolis Grain Exchange. David began his academic career as an Assistant Professor and Extension Marketing Economist at Montana State University after graduating from Iowa State University with a Ph.D. in agricultural economics with fields in agricultural price analysis and econometrics in 1989.  Prior to entering ISU, he received bachelor’s (1982) and master’s (1984) degrees in agricultural economics from Northwest Missouri State University. Dr. Bullock is originally from the small northwestern Missouri farming community of Lathrop which is located 40 miles north of the Kansas City metropolitan area.  While in high school, he served as a regional state Vice-President in the Future Farmers of America (FFA) during his senior year."
James Caton,https://www.ndsu.edu/centers/pcpe/about/directory/james_caton/,"Entrepreneurship, Institutions, Macroeconomics, Computation","James Caton is a faculty fellow at the NDSU Center for the Study of Public Choice and Private Enterprise (PCPE) and an assistant professor in the NDSU Department of Agribusiness and Applied Economics. He teaches undergraduate courses in the areas of macroeconomics, international trade, and computation. He specializes in research related to entrepreneurship, agent-based computational economics, market process theory, and monetary economics. His research has been published in the Southern Economic Journal, Erasmus Journal for Philosophy and Economics, Journal of Entrepreneurship and Public Policy and other academic publications. He co-edited Macroeconomics, a two volume set of essays and primary sources that represent the core of macroeconomic thought. He is also a regular contributor to the American Institute for Economic Research's Sound Money Project, which conducts research and promotes awareness about monetary stability and financial privacy. He resides in Fargo with his wife, Ingrid, and their children."
David Englund,https://www.ndsu.edu/agecon/faculty/englund/#c622903,"Teaches Economic Principles, Led NDSU NAMA to National Champions","David Englund is a lecturer in the department.  He came to the department with 16 years of teaching experience, having taught Principles of Microeconomics, Principles of Macroeconomics, Money and Banking, Consumer Behavior, Selected Topics in Business, and several other classes.  He also had 10 years’ experience advising student NAMA chapters, having been awarded the Outstanding Advisor of the Year for a Developing Chapter in 2002, and the Outstanding Advisor of the Year award in 2009.
David primarily teaches Survey of Economics, Principles of Microeconomics, Skills for Academic Success, Agricultural Marketing, and NAMA (co-teaches).  He joined the NAMA team in the 2014-2015 school year as a co-advisor and helped coach the student team to a 3rd place finish in the national student marketing plan competition at the national conference.
Some of David’s outside interests are jogging, photography, and writing fiction novels.  His latest release, Camouflaged Encounters has received positive reviews."
Erik Hanson,https://www.ndsu.edu/agecon/faculty/hanson/#c622905,"Ag Management, Ag Finance","Erik Hanson is an Assistant Professor in the Department of Agricultural and Applied Economics. He teaches courses on agribusiness management and agricultural finance. Erik completed his Ph.D. at the University of Minnesota in 2016. Prior to that, Erik completed a master’s degree at the University of Illinois (2013) and a bachelor’s degree at Minnesota State University Moorhead (2011)."
Ronald Haugen,https://www.ndsu.edu/agecon/about_us/faculty/ron_haugen/#c654700,"Farm management including: crop budgets, crop insurance, farm programs, custom farm rates, land rents, machinery economics, commodity price projections and agricultural income taxes.",Ron Haugen is an Extension Farm Management Specialist. He has been in the department since 1991. He computes the North Dakota Land Valuation Model.
Robert Hearne,https://www.ndsu.edu/agecon/faculty/hearne/#c622909,"Water resources management institutions, water markets, protected area management, and the economic valuation of environmental goods and services.","Dr. Bob Hearne has been in the Department of Agribusiness and Applied Economics since 2002. He has professional experience in Europe, Asia, Latin America, and Asia."
Jeremy Jackson,https://www.ndsu.edu/centers/pcpe/about/directory/jeremy_jackson/,"His research covers diverse topics, including public choice and the political economy; the social consequences of economic freedom; happiness and well-being; and philanthropy and nonprofits.","Jeremy Jackson is director of the Center for the Study of Public Choice and Private Enterprise, scholar at the Challey Institute for Global Innovation and Growth, and professor of economics in the Department of Agribusiness and Applied Economics at North Dakota State University."
Prithviraj Lakkakula,https://www.ndsu.edu/agecon/faculty/prithviraj_lakkakula/#c623441,,
Siew Lim,https://www.ndsu.edu/agecon/faculty/lim/#c624837,"Her current research is in applied microeconomics, production economics, industrial organization, transportation and regional development. Her recent research works include transportation and  regional development.",Siew Hoon Lim is an associate professor of economics.
Raymond March,https://www.ndsu.edu/centers/pcpe/about/directory/raymond_march/,"His research examines the public and private provision and governance of health care in the United States, particularly in pharmaceutical markets.",Raymond March is a scholar at the Challey Institute for Global Innovation and Growth with the Center for the Study of Public Choice and Private Enterprise and an assistant professor of economics in the Department of Agribusiness and Applied Economics at North Dakota State University.
Dragan Miljkovic,https://www.ndsu.edu/agecon/faculty/miljkovic/#c625001,"Research areas of interest include agricultural price analysis, international economics, and agricultural and food policy including human nutrition, obesity, and food safety.","Dragan Miljkovic is professor of agricultural economics in the Department of Agribusiness & Applied Economics at North Dakota State University. Dr. Miljkovic holds B.S. and M.S. degrees in Economics from the University of Belgrade, and Ph.D. in Agricultural Economics from the University of Illinois at Urbana-Champaign."
Frayne Olson,https://www.ndsu.edu/agecon/faculty/olson/#c625016,"Research in evaluating crop marketing strategies, crop outlook and price analysis, and the economics of crop contracting.",Dr. Frayne Olson is the Crop Economist/Marketing Specialist with the North Dakota State University Extension and Director of the Quentin Burdick Center for Cooperatives.
Bryon Parman,https://www.ndsu.edu/agecon/faculty/parman/#c654590,,
Tim Petry,https://www.ndsu.edu/agecon/faculty/petry/#c625018,Livestock Marketing Economist,Tim Petry was raised on a livestock ranch in Northwestern North Dakota. He graduated from North Dakota State University with a major in Agricultural Economics in 1969 and served two years in the US Army.
Xudong Rao,https://www.ndsu.edu/agecon/faculty/rao/#c629066,"Farm and Agribusiness Management, Risk Analysis, Efficiency and Productivity, Technology Adoption, Food and Agricultural Policy, International Agricultural Development.","Assistant Professor, Department of Agribusiness and Applied Economics, North Dakota State University."
Veeshan Rayamajhee,https://www.ndsu.edu/centers/pcpe/about/directory/veeshan_rayamajhee/,His research combines insights from Public Choice and New Institutional Economics to understand individual and collective responses to covariate shocks.,Veeshan Rayamajhee is a scholar at the Challey Institute for Global Innovation and Growth with the Center for the Study of Public Choice and Private Enterprise and an assistant professor of economics in the Department of Agribusiness and Applied Economics at North Dakota State University.
David Ripplinger,https://www.ndsu.edu/agecon/faculty/ripplinger/#c629078,David conducts research and provides support to farmers and the bioenergy industry.,David Ripplinger is an Associate Professor in the Department of Agribusiness and Applied Economics at North Dakota State University and bioproducts/bioenergy economics specialist with NDSU Extension.
David Roberts,https://www.ndsu.edu/agecon/faculty/roberts/#c629137,His research focuses on the impacts of agricultural production methods on the environment and natural resources. David is particularly interested in the economics of precision agriculture technologies and the response of cropping patterns and land use change to emerging biofuels policy at the Federal level.,David Roberts is an Assistant Professor of Agribusiness and Applied Economics at North Dakota State University.
Kristi Schweiss,https://www.ndsu.edu/agecon/faculty/schweiss/#c629139,,
Anupa Sharma,https://www.ndsu.edu/agecon/faculty/sharma/#c629150,Develops quantitative methods to address issues pertinent to International Trade.,Anupa Sharma is an Assistant Professor in the Department of Agribusiness and Applied Economics at North Dakota State University. She also serves as the Assistant Director for the Center for Agricultural Policy and Trade Studies (CAPTS).
Cheryl Wachenheim,https://www.ndsu.edu/agecon/faculty/wachenheim/#c629162,"Research interests focus on eliciting perceptions and valuations from consumers, firms, students and other stakeholders and decision makers.  Analysis then allows for identification of high-value marketing and management strategies.",Cheryl Wachenheim is a Professor in the Department of Agribusiness and Applied Economics at North Dakota State University.
William Wilson,https://www.ndsu.edu/agecon/faculty/wilson/#c629178,"His focus is risk and strategy as applied to agriculture and agribusiness with a particular focus on agtechnology development and commercialization, procurement, transportation and logistics, international marketing and competition.","Dr. William W. Wilson received his PhD in Agricultural Economics from the University of Manitoba in 1980. Since then he has been a Professor at North Dakota State University in Agribusiness and Applied Economics with periodic sabbaticals at Stanford University. Recently, he was named as a University Distinguished Professor at NDSU which an honorary position is, and a great achievement."
